"campaign_id","product_name","short_description","long_description"
"5652e375-27f9-4288-9148-1e9a029c346b",Napper: Baby Sleep Tracker,"Join the parent tribe enjoying better sleep with Napper! Share your experience, show how it works and how it has made bedtime a breeze without a traditional sell.","Napper: Baby Sleep Tracker is more than just a tracker. It’s an innovative solution for new parents struggling to understand their baby’s sleep pattern. Come, share your experiences, how it has changed your days (and nights). No hard sell, just a gentle nod to a technology that's making parenting a little easier."
"67c29e04-2abb-4fe2-b3c1-e111541f75cc",Unlockt,"It is a safe and useful way to transfer media files (jpg, pdf, mp4…) and ensure you get paid for them ! The app allows you to send files and charge for their download","It is not a website with a subscription where your photos will be posted, the app only offers you to create secure paid links. When you send it to someone or share it in your instagram story nobody will be able to see the pic unless they pay the price you set up. "
aa6a3435-358b-411b-bbba-a4b1a1fbee5a,TikDown,"Promote TikDown, the go-to app for effortlessly downloading TikTok videos without watermarks, making content sharing a breeze.","This campaign aims to raise awareness and drive use of TikDown, an innovative tool that allows watermark-free TikTok video downloading. The campaign will emphasize the app's effectiveness, ease of use, and how it facilitates content sharing unlike any other on the market."
a0da1af2-a59d-481e-a6b6-6ab537c74d61,Bankin’,"Bankin' est une application de gestion d'argent qui vous aide à prendre le contrôle de vos finances. Avec plus de 6 millions d'utilisateurs, Bankin' est une application leader en France pour la gestion financière. ","Elle propose différentes fonctionnalités telles que la gestion de budget, la renégociation de factures, le mini-crédit, le cashback et les programmes d'épargne. L'application vous permet de catégoriser et d'analyser vos dépenses, de regrouper plusieurs cartes bancaires et même de gagner du cashback sur vos transactions avec plus de 500 partenaires."
"5a888a28-3f57-44e4-8e28-ca4805a77630",The Oregon Trail: Boom Town,"Please try to reproduce this kind of video using the provided script below: https://drive.google.com/file/d/18xaGWGdFAh-tADCt7EQGMCVIBumSZ77S/view?usp=sharing
","Please try to reproduce this kind of video using the provided script below: https://drive.google.com/file/d/18xaGWGdFAh-tADCt7EQGMCVIBumSZ77S/view?usp=sharing. Note that the reference video is 17s but we need a longer video (+30s).

Script

I'm going to show you the game I'm hooked on
This game is so nostalgic, it reminds me to old Oregon Trail...but this new game is called Oregon Trail Boom Town!
I had read about this game and I love games to build cities, farms, etc.
But downloading it I saw that it was much more than that.
Yes, it's free ;)
There are so many things to do, build, collect...is just a lot of fun!
In this game you can grow different foods, help your friends, provide the necessary and different items so that the cars can advance to Oregon...
Play mini-games to get money, barter (boats), feed the animals...as you progress you can get more incredible buildings, more land and build an incredible city to your liking.
I'm starting to build cool buildings and fances..:)
Let me show you my town!

Ops! I think someone needs help! 

Let me help her build a hospital and we continue:)

Ok, look now my corns, woods, and all the things i can plant..

Oh and look my animals, they are super happy!
I usually play it before going to sleep as a habit, it makes me disconnect and I prepare things for the next day to be able to pick them up, so for me it is very satisfying.
So I recommend it one hundred percent! Enjoy!"
b03c548c-9b86-4bdc-aae9-b545007118f0,Joko,"Dans cette campagne, vous allez vous adresser directement à la communauté TikTok pour vous aider à faire fonctionner cette vidéo.","Dans cette campagne, vous allez vous adresser directement à la communauté TikTok pour vous aider à faire fonctionner cette vidéo."
d46d90de-b956-4a88-8a69-0110081c4eb2,Clean Manager,"Embrace seamless iOS storage management with Clean Manager. Delete, compress, swipe, sort, block ads - all at your fingertips.","Easily remove unwanted similar pictures, live photos, videos and screenshots on your iPhone or iPad.


Cleaner:

Photo Cleaner:

- Search and delete similar images, screenshots, live photo pictures, gif animations


Video Cleaner:

- Remove large unwanted videos

- Search and remove similar videos



Compress:

- Compress big photo and video files as you want


Swipe:

- Clean up your gallery in a few easy swipes. You choose which photos to keep – an automatic cleaner can't do a better job than you!

- Swipe left, swipe right! Sorting photos has never been so easy

- Sort photos by month


Calendar:

- Remove spam invitations(ads) in Calendar


AdBlock:

- Smart adblocker in Safari


Widgets:

- Battery, Storage and Device info"
"46000baf-2fff-4df0-9084-c9a3fb896eb2",Blitz,Blitz is a unique mobile gaming app that combines the excitement of popular games with the thrill of real cash prizes. ,"Blitz is a unique mobile gaming app that combines the excitement of popular games with the thrill of real cash prizes. Users compete against real players in a fair, skill-based environment across various games like Bingo, Solitaire, Match3, and Ball Blast. In addition, players enjoy daily challenges, weekly contests, and multiplayer tournaments. With rewards, giveaways, and a leaderboard to climb, Blitz is more than just a gaming app; it's a competitive gaming community."
"9d375c71-a2a5-46b9-b431-66eaa1eb121c",Guitar Tuner,"Upgrade your music journey with the Guitar Tuner app. Tune your instruments easily, discover and play new chords, and enjoy learning games; all anytime, anywhere. No extra equipment necessary!","The Guitar Tuner is a revolutionary app designed to simplify and enhance your musical journey. It serves as your on-the-go, easy-to-use tuning system for your guitar, bass, and ukulele. Integrated with AI technology, Tuner provides chord generation for your favourite songs with a comprehensive library of over 2600 chords. The user-friendly design offers intuitive learning games and a metronome with multiple settings, taking your musical expression to the next level."
"6a5174c5-fd32-442e-ac0c-cec0650a0b8b",Automatic Coupon tester,Wanteeed automatically applies the best discounts for hundreds of online stores!,"Wanteeed is a game changer for online shopping, automatically applying the best discounts at hundreds of stores. Whether you are shopping for fashion, tech or homeware, Wanteeed operates in the background, testing and applying the best coupons without interrupting your activity. No more endless searches for elusive discounts or frustrations with expired codes. Just smooth, effortless shopping and maximum savings every time.

We want to make it the talk of the town, making sure everyone knows that Wanteeed isn't just an app; it's your ultimate shopping companion for awesome discounts, making online shopping an absolute blast ! 

Get ready to join the Wanteeed adventure and revamp the way you shop online !"
"96e93035-f904-4844-9747-cc7258aacf85",HiveNet,Boost awareness of HiveNet among Gen Z travelers. Drive sign-ups and conversions with a special discount. Make travel light and secure with digital storage.,"The HiveNet campaign aims to raise awareness of hiveDisk as an affordable, reliable cloud storage option, particularly among tech-savvy Gen Z travelers and parents. We seek to educate potential users about the benefits of securely storing travel-related documents and memories on the cloud. Aligning with these objectives, we aim to drive conversions and new user sign-ups through the use of a special discount code."
"34e08fd4-623f-4413-a1dd-00851c3a7e8f",Yubo: Find friends around you and meet irl,"Showcase the fun of Yubo, you can even find people around to make friends with and do multiple activities together ","Showcase the fun of Yubo, you can even find people around to make friends with and do multiple activities together "
cc5fdd76-4f5e-43c7-8463-3b5f69cfea73,Fashion Verse,"Unleash your creativity with FashionVerse, a digital fashion destination designed for creativity, community, and fun. Style stunning scenes with latest fashion trends.","Join us on FashionVerse, a digital fashion destination for everybody. FashionVerse is all about creativity, community and fun, offering a platform to style stunning scenes using the latest fashion trends and real-life brands we all adore. Unleash your creativity and join our thriving community. Don't just follow trends- set them on FashionVerse!"
"9e7799ff-e3c4-4f50-9246-90faebc0891b",Joko,"L'idée est de faire un spin-off de la vidéo toujours en vous l'appropriant bien sûr à votre sauce et avec un autre son 

https://www.tiktok.com/@lya.fts/video/7407871303983680801?_r=1&_t=8pfD7IEboyP",https://www.tiktok.com/@lya.fts/video/7407871303983680801?_r=1&_t=8pfD7IEboyP
a76144fb-3aa7-423e-a924-51a3705b8a7d,Pocket Champs App,"Pocket Champs is an engaging multiplayer idle game that centers around strategic training in running, flying, or climbing to prepare your Champ for global competition. ","Pocket Champs is an engaging multiplayer idle game that centers around strategic training in running, flying, or climbing to prepare your Champ for global competition. The objective is to outperform other players and claim the crown. Players can enhance their Champs' performance by choosing the right gadgets, such as running shoes, fins, or a pick, each providing a unique advantage in the race. Legendary gadgets like the Eagle or the Cheetah can be unlocked through daily chest openings.
The game offers time-limited events featuring intense races against numerous opponents, adding an element of excitement. While striving for first place, players must navigate challenges and unexpected dangers that can disrupt their race strategy. Pocket Champs combines skillful planning with unpredictable obstacles, creating a dynamic and entertaining gaming experience .
"
"4b18e249-5d28-4620-86fc-568d6b23ceed",Strides: Habit Tracker + Goals,"Strides is a powerful app for tracking all your goals and habits in one place. With four flexible types you can build habits, achieve goals, complete projects on time, stay motivated and always feel organized.","Strides is the ultimate tool for managing your daily routine and achieving any type of goal. Get reminders, track your progress, and stay motivated with comprehensive progress all from one simple app.Don't know where to start? Setting goals is easy with 150+ convenient templates. Apple Health integration and iCloud sync keep your data in sync across your iPhone, iPad and Mac. Make life like a game with streaks, success rates and progress bars to keep improving and achieving your goals."
"91f92932-6923-4c8e-b73a-fcfbd83e3390",Leio,"Leio, the app that enhances your reading experience. Manage, track and organize your reading habits all in one place.","Start using Leio, the digital app designed to elevate your reading experience. The app allows you to manage and track your reading habits, organize your library, and even get projections on when you'll finish a book. Join the reading revolution with Leio and make informed decisions about your reading habits. "
"45cbfc43-dde1-491c-856f-debe56c9e9e8",The Oregon Trail: Boom Town,The Oregon Trail: Boom Town is an interactive game where players build and develop their towns,"Create a 6 seconds BUMPER, some more relaxing than the reference, different script adapted to our product. We only need you talking to the camera, no need to show the phone as in the reference, since we'll add that bit if needed."
"3102bb15-921e-474a-abf5-2a2ce4922a00",Roi,"Roi is an iPhone app for investors, streamlining net worth tracking and trading of diverse assets in one place.","Roi is a free net worth tracking, and investing app provides a unified platform for investors to manage and monitor their finances. It allows users to connect all their bank accounts, brokerages, and digital wallets. Users can track their entire net worth without having to shuffle between multiple apps or manually monitor their assets through a spreadsheet. The app supports tracing of various assets including stocks, ETFs, sneakers, watches, luxury bags, homes, and more."
"333393a4-357b-4816-8948-964ccdc4cb36",Macadam,"Die Macadam App verwandelt Ihre Schritte in Dollar. Mit dem neuesten Update belohnt Macadam Ihre Bemühungen, aktiver zu sein und eine bessere Welt zu schaffen.","Die aktuelle Kampagne von Macadam zielt darauf ab, das neueste Update der App vorzustellen und Menschen dazu zu ermutigen, aktiver zu sein. Jeder Schritt, den Sie machen, wird belohnt und trägt dazu bei, eine bessere und aktivere Welt zu schaffen. Das neueste Update bietet eine effizientere und flüssigere Benutzeroberfläche und viele Fehlerbehebungen und Verbesserungen. Ob Sie ein erfahrener Läufer oder neu in Sachen Fitness sind - Sie sind außergewöhnlich und Macadam ist hier, um Sie zu unterstützen."
c07a5299-7a30-49ad-8498-a11ed34df6b0,LiftBuddy,"Try LiftBuddy, an AI Coach for bodybuilding that personalizes workout and diet plans. Effortlessly pick your program and split, and let the app guide you through your journey.","Join me on LiftBuddy, an AI-powered bodybuilding coach that personalizes your workout and diet plans based on your goals. The onboarding process is simple. You select your desired program and split, and then it's on to the gym where you can see the app at work. It doesn't just assist; it actively coaches you by recommending and adjusting your weight ensuring you constantly break through plateaus. Not only that, it coaches you through your macros based on your progress and makes weekly adjustments. Let's log in to the food database, show how it adjusts, and make most of the LiftBuddy's features."
b21d76fc-09f5-4a15-bf8a-84c56d8c89dc,Ramdam App,Ramdam Test Campaign,"Looking to launch a new video campaign? Our test video package includes everything you need to get started. With high-quality footage, engaging scripts, and expert editing, we'll help you create videos that resonate with your audience and drive results. Whether you're promoting a new product, showcasing your brand, or sharing educational content, our team has the skills and experience to bring your vision to life. Contact us today to learn more about our test video campaign package and take your marketing to the next level."
d160762d-198c-431f-a0d0-cd1e456fc97e,Assurance Habitation,Faites découvrir le produit assurance Habitation Allianz et incitez les utilisateurs à obtenir un tarif sur le site Allianz.,"Notre campagne vise à mettre en avant l'assurance Habitation Allianz et à encourager les utilisateurs à obtenir un tarif sur le site d’Allianz. En montrant les principales caractéristiques et avantages de cette assurance, nous souhaitons susciter l'intérêt et l'engagement des utilisateurs pour ce produit."
c75eb4d9-6f29-4791-82d0-69bb4ce1de77,Deep Belief,"Transformez votre esprit avec Deep Belief, une application d'autohypnose qui vous aide à éliminer les croyances limitantes et à renforcer la confiance et la réussite au quotidien.","L'application Deep Belief est une routine d'autohypnose puissante conçue pour vous aider à éliminer les croyances limitantes et instaurer des croyances positives profondes pour une meilleure confiance en soi et réussite. Elle offre une variété de programmes et est idéale pour ceux qui recherchent une meilleure nuit de sommeil, un esprit tranquille et un renforcement de la confiance en soi et de la motivation."
"119ee7a1-9af0-4e56-9b64-fe4873a745bd",Ramdam Creator App,The ultimate app for content creators who want to get paid for promoting apps !,"With exclusive access to a wide range of campaigns, Ramdam connects you with app developers who are looking to boost their exposure on social media. You'll be asked to describe your experience on the platform."
"0659c6a4-aaf1-40f4-87c6-6d48e81e0523","3asafeer School: Learn Arabic",انضم إلينا في رحلة تعلم ممتعة وفعالة. استعرض كيف يمكن لـمدرسة عصافير  أن تجعل تعلم العربية ممتعًا لأطفالك وتشجع نجاحهم الأكاديمي.,تأخذ حملتنا المشاهدين في رحلة ممتعة لتعلم العربية. بداية من تسليط الضوء على أهمية التعليم المبكر، من خلال عرض قصص الأطفال والكرتون والألعاب التعليمية، والانتقال إلى دعوة للعمل تحث الأهل والمقدمين على الرعاية لبدء طفلهم في رحلة التعلم العربية اليوم. 
eb0616c1-cb3b-49ad-9bbc-0e3e58e5a7af,Ramdam,L'app ultime pour les créateurs de contenu qui veulent être payés pour promouvoir des applications !,"Avec un accès exclusif à un large éventail de campagnes, Ramdam vous met en relation avec des développeurs d'applications qui cherchent à accroître leur visibilité sur les réseaux sociaux. Il vous sera demandé de décrire votre expérience sur la plateforme."
"78a463ab-a2a8-4d21-9f74-ab767408e52b",Bestplay,"Promociona Bestplay i Playtest Pro, una app donde ganas dinero jugando a juegos. Comparte una historia de éxito inventada mostrando lo que has comprado con el dinero ganado. Mantén un tono casual y realista, y sigue las políticas de TikTok y Meta","Estamos contactando a creadores para promocionar nuestra app. Nos gustaría que compartas testimonios espontáneos y naturales, mostrando lo divertida que es la app y dando un ejemplo inventado de qué has comprado con el dinero. Es importante presentar un escenario realista pero atractivo, así que mantén el valor estimado alrededor de 100$. Te animamos a grabar en diferentes entornos, como en el coche, en la cocina o en la cama, para agregar un toque de casualidad y transparencia. Recuerda, se trata de compartir tu historia de éxito con nuestra app.

"
"0bc3df2d-1c94-4660-9a77-68e45e265fa2",Safee,"Gain peace of mind with Safee - a security app offering discreet alerts, real-time tracking, and live video streaming. Ensuring your family's safety 24/7.","Safee aims to provide a safety net for your family with 360° security. With discreet alerts, real-time tracking, and live video streaming on demand, you can always keep an eye on your loved ones. In case of emergencies, Safee's geolocation feature allows for swift action. It's more than an app, it's a guardian angel keeping watch over your family, ensuring their safety, and providing you with the necessary proof to ensure their protection."
f2f729c2-bc90-4b62-9c5e-0c2574b88496,DJ Mix Machine,Feel like a real DJ with DJ Mix Machine. Easy-to-use with pro features for the best music mixing experience. Suitable for beginners and pros.,"Get ready to create amazing groovy mixes like a pro with DJ Mix Machine. This app is the all-in-one DJ tool, with features like jog wheels for scratch effects, synchronization for live performances, various sound effects, and separate channels. Regardless if you're a beginner or a professional, DJ Mix Machine has everything you need for an engaging music mixing experience. Play with thousands of music tracks and enjoy creating your own mix on the fly with this fantastic app."
dde0fc7f-a7d9-448f-b3a4-f039d9b79d28,Hily,"Hily, a favorable dating app with 28M+ global users prioritizes real connections and helps find genuine relationships. ","For this campaign, you should follow the following concept: ""Best First Messages,"" similar to how you receive first messages on Hily Hily (to pronounce ""Highly"") and react to those pickup lines. You must appear in the video for at least 75% of the time.

"
"53730b9d-f120-427b-be75-c623c7af3902",Yubo: Make friends your way,"Showcase the fun of Yubo, and how it brings like-minded people together. You can even find people around to make friends with and do multiple activities together ","The friend finder app’s ability to connect people globally or locally, creates a sense of community and shared the same interest / emotion / passion that transcends geographical boundaries."
"7a5cdef1-0885-41e0-90ca-a6e732ed3015",Yubo: Make friends in your way,"To create ad video to promote the value of Yubo : ""Yubo is a platform that helps you make friend confidently. Believe in yourself when being friend with your tribe on Yubo"". The ultimate objective is to have user download the app ","Yubo is highlighting its socially responsible approach to networking, ensuring a safe and authentic space for users. With millions of users globally, Yubo helps people make genuine friends through chat and live conversations. In a world where social networking can often feel daunting, Yubo stands out as a beacon of authenticity and safety. We believe in being forever young, curious, and unapologetically ourselves. Yubo is more than just an app; it’s a community where you can express your true colors without being judged—no likes, no shares, no comparisons—and expand your mind through meaningful conversations with people from around the globe.

Why Yubo?

- Authentic and Inspiring: At Yubo, we don't shy away from speaking our minds. Our platform is all about showing our true colors and inspiring others to do the same.
- Safe and Secure: Yubo is dedicated to protecting our users’ values, ensuring a safe and respectful environment for everyone.
- Global Connections: Join live streams, participate in multiple conversations, and share your story with people worldwide. It’s all about connecting, learning, and growing together.
- Forever Young: We believe in staying curious, asking questions, and never losing that sense of wonder. Yubo is a space for young spirits to explore and adapt to new universes."
"8c0b0188-78df-45e4-9adf-2de0cbae48b0",Collect Em All!,"Crush same-colored balls, initiate fevers, use boosters, and compete worldwide. Become number one with 'Collect Em All!'","For this collaboration, you'll have to use one of the proposed trends and integrate screenplay from the game. Please check the brief before applying. You will be informed of the trend to follow when you are selected."
f4a41196-d65d-4f7c-b7f7-75b4e861b13a,Wizz App,Please choose one of the 4 concepts explained in the brief,"Our campaign revolves around the highlight of Wizz App's core features - facilitating global communication, improving foreign language skills, and expanding friendship networks. To this end, we'll create a video that emphasizes these aspects in a real-world context. We will give the audience a taste of the app in action, showing how easy it is to connect with people from all parts of the world."
fe6265b2-35f7-4394-9a97-92c806f0ed65,Memorizer,"Ready for a new lifestyle? Memorizer makes every day a cultural journey. Track favorite activities, from art exhibits to new movies. Create and share enriched memories. Don't let algorithms choose for you—get inspired with Memorizer! #YourCultureYourWay","🌍✨ Meet Memorizer, your new personal cultural space. ✨🌍
Imagine a place where every movie you watch, every book you devour, and every dish you savor is captured and kept in a unique cultural profile. Memorizer isn’t just an app – it’s a cultural revolution. 🎬📚🍽️
With our ""memories"" card, find your experiences easily documented with photos suggestion, descriptive texts, ratings, and geolocalization. Create visual to-do lists, to never forget the moments that shape who you are.
Share your discoveries, inspire and connect with a community of like-minded individuals. Whether you’re an urban adventurer or a flavor explorer, Memorizer is here to enrich your cultural journey.
Don’t wait, take control of your interests and cultural expression. Download Memorizer now and start building and sharing your world. #MemorizerLife #ExpressYourCulture "
d775c26c-1f32-4c31-8223-fceddb963e67,Blitz Win Cash ,"Join Blitz Win Cash - an exciting gaming app where you can play, compete, and win real cash prizes. Instant withdrawals available. Download today!","Blitz Win Cash is a gaming app where you can win real cash prizes. Play your favorite mobile games (Solitaire, Match3, Pool, Ball Blast, participate in daily challenges or weekly contests, climb the leaderboards and compete in multiplayer tournaments against real players worldwide. Enjoy the thrill of winning real money with instant withdrawals to your preferred payment method."
"28b137f1-4ace-45c2-bcaf-8581a9615c77",Super-Pharm,Super-Pharm to Twoje wsparcie w pielęgnacji skóry: oferują różnorodne produkty dla różnych typów cery i pomagają zwiększyć Twoje poczucie pewności siebie.,"Kampania Super-Pharm skierowana jest głównie do osób z problematyczną cera, ale również do osób z cerą mieszana i tłustą. Nasze produkty pomagają w codziennej pielęgnacji skóry, a Super-Pharm staje się Twoim guru w dziedzinie urody. Wybieraj spośród renomowanych marek, a także małych firm niszowych. Super-Pharm pozwala poczuć się pewnie, poprawiać samopoczucie i wygląd."
"7d1e163f-fd45-4b73-94f4-d75349181cbf",Gel Douche NATURAL PREBIOTIC SANEX PROTECTION +,"Offrez une protection optimale à votre barrière cutanée avec notre crème de douche hydratante SANEX PROTECTION +. Elle nettoie en douceur et hydrate la peau pendant 12 heures. Vegan et sans sulfates, elle est testée sous contrôle dermatologique.","Quand vous candidatez, merci de préciser quel message vous souhaitez mettre en avant, au choix :
Hydratation ou Recommandation par les dermatologies ou Expertise (Plus de détails dans le brief)."
