"campaign_id","product_name","short_description","long_description"
e8c89ea5-8433-41f6-9a42-3d84538db9bc,Momenzo App,"Create professional real estate listing videos with ease using Momenzo. With templates and media from your phone, enhance your listings and attract more leads.","Highlighting Momenzo's user-friendly interface, this video showcases its effortless process for real estate agents to create stunning listing videos. Emphasizing easy branding and property templates integration, it demonstrates how agents can produce multiple high-quality videos efficiently. The focus is on simplicity, enabling agents to create professional content with just a few clicks. This brief video aims to convey Momenzo's ability to save time, increase productivity, and revolutionize real estate video creation."
"61ee4b5d-fb2d-49b8-a6dd-c43f63ad1216",Yoga Flow,"Engage in a wellness journey with the Yoga Flow app, offering yoga and meditations classes for all levels.","Dive into a realm of tranquility and flexibility with Yoga Flow, a holistic wellness app tailored to guide you through simple to advanced yoga courses and calming meditations. Enjoy the convenience of practicing yoga in the comfort of your own home or any space you prefer."
"9417df2f-2475-4526-884d-c51eae4e61f2",Weekly - Budget App and Planner,"Showcase how Weekly improves financial situations for 93% of users and saves $50-$250 a month on average for its users. Focus on its appeal to first-time budgeters, how it looks great & you can use it to connect to your bank and keep track of your bills.","Our campaign is designed to highlight the effectiveness and simplicity of Weekly a Budgeting App and Planner. According to recent stats, 93% of users see significant improvement in their financial situation after using the app for just two weeks. Moreover, most users report saving between $50 - $250 a month. Especially appealing to first-time budgeters (who make up 60% of its user base), Weekly provides unique approach to budget management, making it appealing to a wide audience especially those that are tired of overwrought budgeting systems."
"0952bf56-72bb-4153-828e-d920c88aa66a",Hily,"Hily, a favorable dating app with 28M+ global users prioritizes real connections and helps find genuine relationships. Join to start your love story!","FREE CONCEPT : YOU MUST DESCRIBE WHAT YOU WANT TO DO WHEN YOU CLICK ON APPLY
"
d280fa5d-40c6-4e09-a925-8cdcf83c7c70,Manga Reader,"Experience endless manga possibilities with Manga Reader! Explore a vast library, enjoy seamless reading, personalized recommendations and download manga for offline reading.","Manga Reader is the ultimate app for all manga fans, unlocking a world of endless manga possibilities. This app, designed by passionate manga lovers, offers a super-fast, smooth, and seamless reading experience. Its vast library includes new chapters as soon as they're available, accompanied by personalized recommendations. Manga can also be downloaded for offline reading. The minimal and non-intrusive ads even in the free version makes the reading experience enjoyable. Discover the best manga titles, save your favorites, and embark on your manga journey with Manga Reader!"
c5c990f9-a862-413a-9463-1abd42ac0728,Udexia ,"Udexia, the perfect Christmas gift for lovers of enigmas and escape games. There's no story in Udexia, only puzzles to solve. Diverse and varied, they'll give you a hard time with an interactive mechanism. ","Hand-illustrated in black and white, it's 52 puzzles ranging from jigsaw puzzles to mazes, logic and mathematics. They can be solved online by scanning a QR code on each page. It's very simple: you enter your answer on the site, which sends back a key to place in the book. You'll need them for the rest of the game. "
e5f9ad34-979b-4505-84bd-2bc7190f122e,Yubo: Your Unique Buddies Onwards,"Showcase the fun of Yubo, and how it brings like-minded people together. You find your petlover friends in the same town / some blocks away , and you starts do activites with your pets together thanks to Yubo","The friend finder app’s ability to connect people globally or locally, creates a sense of community and shared the same interest / emotion / passion . You find your petlover friends in the same town / some blocks away , and you starts do activites with your pets together thanks to Yubo or with your new friends, you can start to ask advices about how to take care of your pet"
"9077be9c-8769-4ca8-a23f-635715aff827",Meetic,Le service de rencontres numéro 1 pour commencer une vraie histoire,"Chez Meetic, nous avons à cœur de permettre à tous les célibataires de commencer une vraie histoire. Leader européen des services de rencontre, Meetic est présent dans 21 pays et est à l’origine de 8 Millions de couples. Depuis 20 ans, nous innovons afin de fournir le meilleur service en ligne et lors de nos nombreux événements pour célibataires à travers toute l’Europe.
Meetic en Chiffres clés :
- Le service de rencontres numéro 1 pour commencer une vraie histoire
- Le service de rencontres le plus recommandé par les célibataires
- 1 français sur 4 connaît un couple Meetic
- Prix du meilleur service client 2022"
a181bab0-0f38-4124-8fd8-dfe7f1e4cd4d,PixPay,"Pixpay è la prima carta di pagamento per adolescenti disponibile a partire dai 10 anni, per imparare a gestire un budget.","ATTENZIONE, LA CAMPAGNA È RISERVATA ESCLUSIVAMENTE AI CREATORS CON ETÀ COMPRESA TRA I 18 E I 24 ANNI.

PRATICA: È utilizzabile ovunque, in negozio, online e presso i distributori automatici. I genitori possono programmare il pagamento della paghetta dei loro figli e monitorare le loro spese con notifiche in tempo reale.

SICURA: La carta è completamente configurabile dall'applicazione dei genitori. Il genitore sceglie l'importo da distribuire ogni mese, definisce i massimali, i limiti di utilizzo e persino i luoghi in cui la carta può essere utilizzata. Ad ogni età il suo grado di autonomia!

EDUCATIVA: Grazie alle nostre 6 modalità di risparmio automatico, il bambino assume responsabilità in modo ludico dalla sua applicazione per bambini. Ha anche una cassaforte virtuale, in cui i suoi soldi possono essere bloccati o sbloccati, per aiutarlo a finanziare i suoi grandi progetti."
"56138a21-7daf-48ee-a25c-0f7c2afc8716",Fruitz,Fruitz is a dating app that aims to make dating easier and less stressful for you.,"What sets us apart from other dating apps is that we offer four different ""fruits"" that you can choose from depending on what you're looking for.

🍒 If you're looking for a serious relationship, go for Cherry
🍇 if you're just looking to have a good time and hang out, Grape might be your choice
🍉 if you're interested in something more casual, Watermelon is your fruit
🍑 if you're after a more intimate encounter, then Peach is the one for you

Our app is a safe and inclusive space where we promote honest dating. You can efficiently find like-minded matches and be part of our diverse community, which values honesty, freedom, humor, tolerance, and kindness. Discover your perfect fruit match with Fruitz today!"
d2a97388-ec99-480c-99f7-41af4b2a6f93,Jelly Juice,Nous souhaitons trouver de nouveaux utilisateurs pour notre jeu de match 3 Jelly Juice. Le public cible est constitué de femmes de plus de 45 ans (principalement des mères et des grands-mères qui travaillent à domicile et qui ont le temps de jouer).,"L'objectif de la campagne est d'inciter de nouveaux utilisateurs à télécharger l'application Jelly Juice.

Jelly Juice est un jeu de correspondance inspiré des célèbres Candy Crush et Royal Match.
Le jeu est gratuit et la principale différence avec les autres jeux est qu'il n'y a pas de publicité qui perturbe l'expérience de l'utilisateur.
Les utilisateurs apprécient le développement du jeu, avec la décoration et l'ameublement des pièces.
Le jeu peut également être joué hors ligne, ce qui le rend encore plus populaire car les utilisateurs peuvent jouer dans le métro, pendant un vol ou sans utiliser de données téléphoniques."
"4dd1350f-68f0-48f2-bf05-d10a40d49c69",MMA Manage 2: Ultimate Fight,"Build an MMA empire with MMA Manage 2: Ultimate Fight! Recruit fighters, strategize fights, and compete against others for ultimate glory.","MMA Manage 2: Ultimate Fight gives players a chance to build their MMA empire from the ground up. As a manager, players can scout and develop champions of tomorrow, outfit gyms with state-of-the-art equipment, and utilize diverse training programs to enhance fighter's skills. It boasts a variety of game modes, allowing players to test their strategies and compete against other players for glory."
"9120a1d3-27e2-4202-9c86-25551752430b",AppBlock,Promote AppBlock and show how it helps to manage time effectively by limiting access to distracting apps.,"Join us in promoting AppBlock, a powerful tool that helps users improve productivity by limiting access to distracting apps. Show your followers how they can take control of their phone usage and focus on what matters most. Remember, this isn't about selling the app; it's about sharing how you use it to manage your time effectively."
"1aebe823-ee42-461c-ac03-792d322358d7",Box Blissim,Replace this with a brief summary of the marketing campaign for Box Blissim. This should be no more than 250 characters.,"Replace this with a detailed description of the marketing campaign for Box Blissim. Explain the objectives of the campaign, how it relates to the product, and any other important details about the campaign."
"158d33fa-4486-4bd1-af5e-a7036bc6611d",Joko,"Pour cette collaboration, l’idée est de créer une vidéo où tu prépares ton shopping de Noël avec ta fille, en utilisant l’application Joko pour profiter de méga bons plans ! 🎄🛍","Coucou les mamans !

Pour cette collaboration, l’idée est de créer une vidéo où tu prépares ton shopping de Noël avec ta fille, en utilisant l’application Joko pour profiter de méga bons plans ! 🎄🛍

Voici ce que nous aimerions voir :

Introduction chaleureuse – Commence la vidéo avec un petit “Coucou les mamans !” en expliquant que tu pars faire des achats de Noël avec ta fille.

Préparation – Montre comment tu utilises Joko pour repérer les bons plans et les offres cashback chez les enseignes partenaires avant de te rendre en magasin.

Moment en magasin – Filmez quelques scènes pendant que vous faites vos achats ensemble, en montrant l'application Joko à l’écran. Par exemple, vérifie un bon plan sur l'appli ou montre les économies que tu fais en direct pendant vos achats.

L’aspect festif – Capture la joie de faire du shopping de Noël ensemble, avec un focus sur les articles que tu trouves grâce à Joko, tout en gardant un ton authentique et chaleureux.

Conclusion – Termine la vidéo avec une petite note amicale et encourage les autres mamans à utiliser Joko pour leurs achats de Noël !

Inspiration vidéo ici : https://www.tiktok.com/@annabelle095/video/7425071088935161093

Conseils pour la vidéo :

Reste naturelle : L’objectif est de montrer un moment authentique entre mère et fille.

Mets en avant Joko : Fais en sorte que l’utilisation de Joko apparaisse clairement, pour inspirer d’autres mamans à l’essayer.

Festif et chaleureux : La période des fêtes est l’occasion parfaite de partager de la bonne humeur et des astuces d’économies."
"297632d4-c512-497d-834f-ea43d33b25bf",Joko,"Dans cette campagne, on montre comment gagner de l'argent en faisant ses courses grâce aux bons d'achat Joko.","Dans cette campagne, on montre comment gagner de l'argent en faisant ses courses grâce aux bons d'achat Joko."
"9a856b87-7fca-4ec5-96c0-4176a05a52df",Morgen,"Manage your tasks efficiently with Morgen, an all-in-one digital planner. It integrates your calendars, project managers, and to-dos in one place for effective planning across multiple platforms.","Morgen is not just another digital planner, it's an all-encompassing time management tool for those who want to be intentional with their time. It's designed to streamline your day by connecting all your calendars, to-do lists like Todoist, and project managers like Notion, allowing you to plan and time block your tasks efficiently. It is the ultimate reality check for any to-do list - simply start adding tasks onto your calendar for a realistic plan. 

The sleek desktop app is available on MacOS, Windows, and Linux, and is complemented by companion iOS and Android apps, keeping you synced irrespective of the platform you are on."
c6ce1af1-b0da-4e90-b93b-7f229cc9d7a1,Joko,"Dans ce concept, l'idée est de montrer qu'en checkant Joko avant de faire un achat on trouve toujours une bonne raison de faire son achat avec Joko (cashback, codes promo...)","Dans ce concept, l'idée est de montrer qu'en checkant Joko avant de faire un achat on trouve toujours une bonne raison de faire son achat avec Joko (cashback, codes promo...)"
"3bf859e6-7f16-4590-bad6-ff0344302a01",The Oregon Trail:boom Town,Make a video inspired in that two references below with a person recording themselves on his house (LIKE A SELFIE VIEW)  talking about OREGON TRAIL BOOM TOWN and showing gameplay.,"Make a video inspired in that two references below with a person recording themselves on his house (LIKE A SELFIE VIEW)  talking about OREGON TRAIL BOOM TOWN and showing gameplay. Please note that we will add the gameplay in post-production, so we only need you to record yourself. Follow the script below. Add texts. Full idea and references here: https://app.milanote.com/1RB0vV1Tvt1b0d?p=pxlodgsEboi

Script:

I'm going to show you my favourite cozy game!

The game is called Oregon Trail Boom Town.

I had read about this game and I love games to build cities, farms, etc.

But downloading it I saw that it was much more than that.

Yes, it's free ;)


There are so many things to do, build, collect...is just a lot of fun!

In this game you can grow different foods, help your friends, provide the necessary and different items so that the cars can advance to Oregon...

Play mini-games to get money, barter (boats), feed the animals...as you progress you can get more incredible buildings, more land and build an incredible city to your liking.

I'm starting to build cool buildings and fances..:)

I think it's a cozy game because I don't like to be frustrated when I'm playing a game and little by little you can achieve more things and it is not a stressful game.
I usually play it before going to sleep as a habit, it makes me disconnect and I prepare things for the next day to be able to pick them up, so for me it is very satisfying.

So I recommend it one hundred percent! Enjoy! "
"0ca82647-6f09-42dd-9582-eb0126d59949",SwipeWipe,"SwipeWipe, l'appli qui simplifie le nettoyage de votre pellicule. Révisez vos photos mois par mois, gardez les meilleures et éliminez le reste.",Pour cette campagne vous devez répliquer à l'identique la vidéo présentée dans brief. 
"011b2e57-c95d-4155-b8b5-b7c52f387442",Top Eleven,"Top Eleven ist ein kostenloses Fußball-Management-Spiel für Mobilgeräte. Manager können ihren Verein vollständig anpassen - Taktik, Formation, Stadion, Trikot, Wappen - und gegen andere Spieler auf der ganzen Welt antreten.","Wir bieten Ihnen die Möglichkeit, einzigartige und fesselnde Videos mit unserem exklusiven In-Game-Material zu erstellen. Zeigen Sie Ihre Kreativität und Fußballleidenschaft einem breiteren Publikum. Top Eleven ist ein kostenloses mobiles Fußball-Management-Spiel. Passen Sie die Taktik, Formation, das Stadion, das Trikot und das Wappen Ihres Vereins an. Spielen Sie täglich 3D-Spiele und treten Sie weltweit an. Perfekt für alle, die eine Karriere im Fußballmanagement starten und ihren Verein an die Spitze führen wollen."
"56735aa4-d694-4527-b7fd-4b3f2085f106",Clone,"Join our TikTok campaign for Clone, our AI avatar app. Show how fun and easy avatar creation is, then incorporate your avatar into trending TikTok themes.","Clone invites you to be part of our exciting TikTok campaign, aimed at promoting the launch of our cutting-edge AI avatar generation app. We want to showcase how effortless and engaging it is to create personalized avatars using our app. Furthermore, we aim to demonstrate how these creations can be integrated into popular and trending TikTok themes. To participate, simply send us about fifteen photos of yourself, and we'll return a few avatar images for you to incorporate into your video production."
c2eea22d-a772-4237-97ad-71ad35885cfb,Gentler Streak,"Gentler Streak ist ein individualisierter Fitness-Tracker, der Ruhephasen integriert, um ein gesundes Aktivitätsniveau zu unterstützen. Über 140 Workouts und Gesundheitsfunktionen zur Auswahl.","Gentler Streak ist ein revolutionärer Fitness-Tracker, der an Ihre individuellen Bedürfnisse angepasst ist. Anstatt nur auf Schritte oder körperliche Leistung zu achten, berücksichtigt Gentler Streak Ihre gesamte Wellness und passt sich Ihren individuellen Bedürfnissen und Fähigkeiten an. Über 140 Workout-Optionen und eingebaute Funktionen wie Einblicke, tägliche Gesundheitszusammenfassung und Schlafüberwachung machen Gentler Streak zum ultimativen Fitness-Tool."
f10de9df-2e42-4f79-86dd-f72a6c738cb0,Beat Maker Pro,"Jump-start your beat making skills with Beat Maker Pro. With over 1000 lessons, learn from pro beat-makers, explore music styles, and share your creations with the world!","Embark on your beat-making journey with Beat Maker Pro, your ultimate music coach. Ranging from the beginner level to the advanced, the app offers over 1000 unique sound pack lessons, devised by expert beat makers. You can master a variety of music styles like EDM, trap, house, etc. The app also boasts an intuitive drum pad feature, a music sharing platform, and an exciting career mode. Start today and become a beat-making superstar!"
"40e4fd3e-bdaf-4eb8-9571-3f2a56c79f52",GoTrendier México,"GoTrendier busca colaboraciones para una campaña de moda de segunda mano. Se pide unboxing, énfasis en la calidad, precio, posibilidad de outfits y hallazgos en tendencia.","GoTrendier México busca colaborar con creadores de contenido para una campaña de anuncios sociales que muestre que comprar moda de segunda mano puede ser seguro, económico, y fashion. Queremos que los creadores realicen un unboxing, resaltando la calidad y precio de la prenda y enfocándose en distintos temas como el estado de la prenda, los outfits posibles, hallazgos en tendencia y tips para encontrar tesoros de moda en la app."
"1623e556-ccfa-4aa7-ac67-697aa976a252",Macadam ,"Avec Macadam, transformez vos activités physiques en euros. Suivez vos pas, votre distance et vos calories brûlées tout en gagnant de l'argent.","Téléchargez l'application Macadam pour transformer chaque pas que vous faites en euros. Que vous marchiez tranquillement ou que vous soyez en plein entraînement de running, chaque pas compte. Compatible avec Google Fit et les montres connectées, Macadam vous permet de suivre chaque calorie brûlée et chaque distance parcourue tout en gagnant de l'argent!"
"658cc43a-4edc-4662-91d6-32ebbf75b4a3",Création d'entreprise,"LegalPlace, une solution juridique simple et rapide pour créer votre entreprise ou modifier vos statuts. Accompagnement complet avec plus de 300 000 utilisateurs.","LegalPlace est un service juridique en ligne qui simplifie les formalités juridiques pour les entrepreneurs. Que vous souhaitiez créer une entreprise ou modifier vos statuts, LegalPlace offre une solution complète. Avec plus de 300 000 utilisateurs, leur interface facile à utiliser et leur accompagnement complet rendent le processus juridique plus simple et plus rapide."
"066d9ad2-4e4c-4dcc-baf3-647886dfd8a9",Mojo,"Cree contenido de video asombroso para las redes sociales con Mojo. Seleccione entre una multitud de plantillas, efectos de texto y filtros, y aumente sus vistas con subtítulos automáticos.","Impulsa tu creatividad y tus redes sociales con Mojo, una aplicación de diseño de contenido de video. Escoge entre más de 1.200 plantillas, aplica efectos de texto y filtros, añade subtítulos automáticos y destaca en tu perfil de Instagram al crear contenido en cuadrícula. Disponible para descargar de forma gratuita."
"45670dfe-7e03-430c-a645-18169bb14961",Ramdam,"Die ultimative App für Inhaltsersteller, die für die Bewerbung von Apps bezahlt werden möchten! ",Join the Ramdam campaign! Earn revenue by promoting a wide range of apps. Keep true to your style and show the ease of its use!
"14cfc38a-327a-4227-a6f7-51c8f8620644",Exposed - Party game app,"Exposed is a thrilling party game app with over 5000 truths, dares, and challenges. Great for friends, it's the modern alternative to classic party games.","Discover Exposed – the ultimate party game app designed to shake up your social gatherings! With Exposed, you're getting more than just a game; it's your ticket to uncovering fun, cheeky, and even absurd sides of your friends, courtesy of over 5000 different truths, dares and challenges. It has 4 game modes tailored to fit every situation, serving as the perfect icebreaker and clash generator. Replace your outdated spin the bottle and truth or dare routines with Exposed, and elevate your game nights like never before!"
ea87c33d-7c93-48a2-90d0-484966099d8c,Abonnement Seazon,"Seazon est un abonnement de plats variés et gourmands, cuisinés par des che·fes et livrés chaque semaine chez vous. Choisissez vos recettes préférées et régalez-vous en 2min30 au micro-onde ! ","Seazon est un service unique d'abonnement à des plats variés et délicieux, livrés à votre porte chaque semaine. Choisissez parmi des recettes cuisinées à partir d'ingrédients de saison, principalement bio et labellisés, et modifiez votre abonnement à tout moment sans aucun engagement. Que vous soyez à la maison, au travail ou en vacances, Seazon est là pour simplifier votre vie. À vous de jouer, choisissez vos plats et savourez!"
"543eca92-5ba2-4de4-8708-dac5dc7a8a51",Joko,"Dans cette campagne, on présente Joko en montrant le hack du cashback en direct sur un ordinateur","Dans cette campagne, on présente Joko en montrant le hack du cashback en direct sur un ordinateur"
aaedbb57-62c7-47bf-a75a-a8476ae727d2,Minglefair,"Join Minglefair's local connection revolution! Rediscover the joy of face-to-face interactions, celebrate community, and forge lasting bonds. With diverse activities and welcoming spaces, let's make memories and embrace genuine connections.","In a world where digital connections often overshadow face-to-face interactions, Minglefair is leading a revolution – one that champions the power of genuine, local connections. Our campaign is more than just a call to action; it's a rallying cry for communities everywhere to come together, share experiences, and forge bonds that transcend the digital realm.

With Minglefair, we're redefining socializing. Gone are the days of superficial interactions and fleeting conversations. Instead, we're embracing the authenticity of real-life connections – the kind that leave a lasting impact and create memories to cherish.

Throughout the campaign, we'll be showcasing the diverse range of opportunities available on Minglefair. From outdoor adventures to cultural explorations, there's something for everyone. Whether you're a seasoned social butterfly or someone looking to step out of their comfort zone, Minglefair offers a welcoming space where you can meet like-minded individuals and discover new passions.

But our campaign isn't just about the activities – it's about the people. We'll be shining a spotlight on the incredible stories and connections that have been forged through Minglefair. From lifelong friendships to unexpected encounters, every interaction has the potential to spark something magical.

So join us as we embark on this journey to embrace the local connection revolution. Together, let's rediscover the joy of face-to-face interactions, celebrate the richness of our communities, and build a world where genuine connections thrive. Get ready to make memories, forge friendships, and experience the magic of Minglefair."
d230a340-2a99-4036-bdf6-af13eaa0311f,helios,Le compte bancaire qui agit (vraiment) sur le climat : gérez votre argent simplement via une application fluide et optimisée et soutenez la transition écologique.,"Montrez comment l'application helios révolutionne votre expérience quotidienne par une vidéo dynamique, créative et originale qui attire l'attention.
IMPORTANT: Vous avez le choix entre 6 concepts (voir brief), vous devez préciser lequel vous intéresse quand vous candidatez."
"6a78339f-ad8b-40c3-bf20-073d6c086372",align27 ,Someone speaking in front of the camera and explaining how they used to do things at the wrong time before using the app ,Someone speaking in front of the camera and explaining how they used to do things at the wrong time before using the app 
"02528a9d-0299-4022-86ee-c9f730b6c5bc",Mojo,"Mojo is a social content maker app designed to help users create stunning and engaging Insta Stories, Reels, and social media posts.","The app offers over 500 unique animated templates, original text styles, background music, and more for various occasions, catering to niches such as fashion, fitness, and photography. Mojo is trusted by influencers, content creators, small businesses, and e-shops and has over 30 million users worldwide."
