"campaign_id","product_name","short_description","long_description"
"51831d3f-cb5f-4ce1-94df-f56b7b9fea23",Beyond Body - Personalized Wellness Book,"Embark on a personalized wellness journey with Beyond Body – tailored 28-day meal plans, custom workout routines, mindfulness techniques, and habit-building strategies designed to boost health and confidence.","Beyond Body is more than just a wellness book, it's a personalized journey towards better health and self-confidence. It crafts a unique 28-day meal plan, a tailored workout routine, mindfulness techniques, and habit-building strategies for each individual reader. Our target audience is predominantly women over the age of 25, who are interested in losing weight and living a healthier lifestyle, but lack the educational resources. With Beyond Body, we eliminate trial and error, and offer a customized path to wellness."
aff29b17-7d00-43a9-accc-28342c15faa0,Better In Person Dating App,Seeking creators to create UGC-style videos highlighting how our dating app stands out and showcasing its key features.,"Better in Person is a dating app for intentional people that prefer to meet in real life instead of endless chatting. No penpals, no f*ckboys and no catfish allowed. It features a verification video on every profile so there are no catfishing, and it effortlessly turns matches into real dates. In general, talk about this new app you've just discovered or using — explain how it's different and why others should give it a try. Call to action: Encourage viewers to download the app for FREE and explore its benefits."
bfe17c54-6a0b-4357-9c42-f2c47d647312,ISM,"Play around with Ism Lens for that cool twist, and breeze through edits with our easy copy-paste. It’s all about your vibe, your vision. Ready to remix your pics? ","Unlock the potential of your creativity with ISM, a tool featuring over 300 professionally curated preset filters for your pictures. Perfect for individuals of any experience level, ISM takes the complexity out of photo and video editing with its one click selection. Choose various styles from professional photographers around the globe. Whether you're after a soft and dreamy look or an urban, artsy flair, ISM has you covered. Explore a world of limitless possibilities with ISM’s intuitive UI, frequent updates, and unlimited access to exclusive filters and effects with ISM PRO."
b047aaef-f3ce-4758-84ea-784ee41026cf,Officiel QI Test,"Promouvoir Officiel QI Test, un service de test de QI en ligne qui évalue l'intelligence de manière innovante et précise.","Dans cette campagne, nous voulons promouvoir Officiel QI Test, un moyen innovant et pratique de mesurer l'intelligence en ligne. Le test évalue le QI à travers quatre dimensions clés : concentration, capacité visuelle, mémoire, et réactivité. Il offre aux utilisateurs une occasion unique d'en apprendre plus sur eux-mêmes et de comprendre leurs forces et faiblesses cognitives. Le but est de montrer comment le test peut être utilisé pour aider à identifier les domaines d'amélioration et à atteindre un développement personnel continu.
"
"7ff00182-260c-44de-ac4a-068ce407e64c",Joko,"Dans cette campagne on commence par un hook où vous mentionnez avoir été influencé par TikTok, avant de donner des précisions sur l'application Joko.","Dans cette campagne on commence par un hook où vous mentionnez avoir été influencé par TikTok, avant de donner des précisions sur l'application Joko."
"77a6babe-ac16-47f6-b39c-799d153700e4",Capture,"Capture is the representation of your real life relationships. No influencers, no brands, no likes, no algorithms – just you and your friends sharing moments of your lives as you live them… with a surprise.","ATTENTION: This collaboration is exclusively for US residents!
Camera :
Capture and share all in just one tap. The fastest way to share what you’re up to with friends…for real.

Feed :
Tilt your phone as you scroll to see what your friends are really up to. When you’ve caught up with the latest Captures, we’ll kindly ask that you turn your phone off and go hang out with friends IRL.

Comments :
There are no likes on Capture so you’ll need to be a little more intentional when reacting to what your friends are sharing."
"29f98a16-dd03-4b4c-8145-2064de159389",Yubo: Make friends in your way,"To create ad video to promote the value of Yubo : ""Yubo is a platform that helps you make friend confidently. Believe in yourself when being friend with your tribe on Yubo"". The ultimate objective is to have user download the app ","Yubo is highlighting its socially responsible approach to networking, ensuring a safe and authentic space for users. With millions of users globally, Yubo helps people make genuine friends through chat and live conversations. In a world where social networking can often feel daunting, Yubo stands out as a beacon of authenticity and safety. We believe in being forever young, curious, and unapologetically ourselves. Yubo is more than just an app; it’s a community where you can express your true colors without being judged—no likes, no shares, no comparisons—and expand your mind through meaningful conversations with people from around the globe.

Why Yubo?

- Authentic and Inspiring: At Yubo, we don't shy away from speaking our minds. Our platform is all about showing our true colors and inspiring others to do the same.
- Safe and Secure: Yubo is dedicated to protecting our users’ values, ensuring a safe and respectful environment for everyone.
- Global Connections: Join live streams, participate in multiple conversations, and share your story with people worldwide. It’s all about connecting, learning, and growing together.
- Forever Young: We believe in staying curious, asking questions, and never losing that sense of wonder. Yubo is a space for young spirits to explore and adapt to new universes."
db609107-3ffa-4835-84dc-5b9bb91e5e90,Joko,"Dans cette campagne un papa se prépare en mode commando pour Black Friday en regardant toutes les offres de mega cashback sur Joko. Il veut faire plein d'économies.

https://www.tiktok.com/@justfabonline/video/7304385152917196078?lang=en","https://www.tiktok.com/@justfabonline/video/7304385152917196078?lang=en

C'est l'inspi mais n'hésitez pas à ajuster un peu le concept selon votre personnalité ! 

Dans cette campagne un papa se prépare en mode commando pour Black Friday en regardant toutes les offres de mega cashback sur Joko. Elle veut faire plein d'économies. "
"1667da39-50b3-404b-a18c-e271460c19ac",CozyCozy,"The only platform with ALL accommodations available, and the only one in the world listing Airbnb offers.","ATTENTION, LE BRIEF EST EN ANGLAIS, MAIS VOUS DEVEZ FOURNIR UNE VIDEO EN FRANCAIS POUR UNE AUDIENCE FRANCAISE
Cozycozy allows travelers to find their perfect stay quickly and easily. With access to over hundreds of booking platforms, including Airbnb, travelers are able to compare prices, locations, and amenities to find the perfect accommodation for their next trip. Cozycozy is free to use and provides easy-to-read and transparent offers, customizable search options, and an instant booking feature. Download the app today and find your perfect stay!"
"84b31102-1ead-400f-ad18-8003960a83fd",Mojo,"Mojo é um aplicativo de criação de conteúdo social projetado para ajudar os usuários a criar Insta Stories, Reels e publicações em redes sociais impressionantes e envolventes.","🚨Para essa colaboração, será solicitado que você replique um dos dois vídeos apresentados no briefing. Especifique sua escolha ao se inscrever. Se você não seguir esse processo, sua inscrição não será aceita."
c67d11b9-bbd5-41f7-ba47-17f7ecb5fba2,Strides: Habit Tracker + Goals,"Strides is a powerful app for tracking all your goals and habits in one place. With four flexible types you can build habits, achieve goals, complete projects on time, stay motivated and always feel organized.","Strides is the ultimate tool for managing your daily routine and achieving any type of goal. Get reminders, track your progress, and stay motivated with comprehensive progress all from one simple app.Don't know where to start? Setting goals is easy with 150+ convenient templates. Apple Health integration and iCloud sync keep your data in sync across your iPhone, iPad and Mac. Make life like a game with streaks, success rates and progress bars to keep improving and achieving your goals."
"325e09f4-bd86-4cd7-af25-cfa781a44efe",SpongeBob Adventures,Join SpongeBob and friends on a mission to restore Bikini Bottom in the exciting 'SpongeBob Adventures' game!,"Plankton's latest plot has turned Bikini Bottom into a JellyFish Jam disaster! Embark on an epic adventure with SpongeBob and friends in 'SpongeBob Adventures'. Team up with new and old friends, uncover surprises, and help restore order. Join the mission to rebuild Bikini Bottom and thwart Plankton's plans once and for all."
"6fd6f372-4d38-4e53-b6a1-c8ff16c973b4",Voggt,"Le concept est simple : ️des vendeurs montrent leur sélection d'objets en live et lancent des enchères, souvent à prix de départ à 1€ pour pimenter la vente. Les acheteurs échangent en live dans le chat et posent des questions.","Le format est libre, mais ta vidéo doit impérativement inclure ces 2 points :
1. 
    - Voggt est une application de live-shopping où vous pouvez acheter et vendre en direct des vêtements, des chaussures, des accessoires, et plus encore.
    - Une nouvelle manière d'acheter plus divertissante, combinant le frisson des enchères à partir de 1€ avec l'interactivité d'une communauté dynamique.
 🤔 Quelques inspirations :
- **Haul** : Partage tes trouvailles après une séance de shopping en direct sur Voggt (#VoggtHaul).
- **Unboxing** : ""Je viens de recevoir mon colis Voggt, j'ai hâte de l'ouvrir !”
- **Les bons plans** : ""J'ai trouvé une robe Sandro pour 12 €, grâce à cette application !""
- **Les bons plans maternité** : Explique comment Voggt change la donne pour les mamans.
- **Communauté et bonnes affaires** : ""Tu cherches un moyen de passer tes soirées à dénicher des bons plans et à te faire de nouveaux amis ?
- **Vide dressing** : Par exemple “Adepte des vides-dressing ? Tu vas adorer cette application !”"
"6a38f58b-9f0b-4c30-abe6-67ce476a24cd",Yumi Club,"On veut faire connaître Yumi aux utilisateurs de TikTok, qui rêvent de chatter avec les célébrités qu'ils admirent ou qui souhaitent créer plus de lien.","Cette campagne de communication nous permet de faire connaître Yumi aux utilisateurs de Tik Tok, aux jeunes qui rêvent de pouvoir chatter avec les célébrités qu'ils admirent le plus ou qui souhaitent tout simplement créer plus de lien avec leurs idoles. Nous leur permettons aussi de chatter avec les plus belles modèles qui peuvent se convertir en leur petite-amie ! Yumi est fait pour s'amuser, discuter et passer de bon moment avec un contenu 100% personnalisé ! Ta star préférée pourra rapidement devenir l'ami dont tu as toujours rêvé ! Ce qui est génial c'est de pouvoir interagir enfin de manière personnalisée avec les créateurs que tu suis peut-être depuis des années sur les réseaux sociaux !! Et là ils deviennent même tes meilleurs amis, voire ta petite-amie ;)"
b65c09e8-369c-46e8-aeaa-ace87fdcef3c,Weapon Master,Únete a nuestra campaña para Weapon Master: ¡Gun Shooter Run! Experimenta un emocionante tiroteo y una elaboración estratégica en este juego lleno de acción.,"Weapon Master: Gun Shooter Run, un juego lleno de acción que combina la jugabilidad de disparar y correr con mecánicas de creación estratégica. Esta campaña se centrará en destacar la emocionante acción del juego, su variada jugabilidad con armas y su profundo sistema de artesanía para atraer tanto a los jugadores ocasionales como a los más exigentes."
b6b80b15-dcf7-4d69-ae9b-5f663edd6c97,Blitz Win Cash,Showcase the exciting and engaging Blitz Win Cash app where users can play games and stand a chance to win daily cash prizes.,"Join the 'Blitz Win Cash' campaign and showcase your skills in a variety of trivia and word puzzle games. Highlight how users can engage with the app anytime, anywhere, and stand a chance to win real cash daily. Keep your content engaging and genuine, capturing the excitement of the game and the thrill of winning! Remember, the main point is to show the fun of playing, not to oversell the product."
af039396-3ccc-4ea7-bc9c-f1aa0d648a08,Blitz Win Cash,"Promoting 'Blitz Win Cash' by replicating a given video in a unique style, highlighting the fun of playing games and winning real cash.","This campaign aims to promote 'Blitz Win Cash', an immersive mobile gaming platform where users can have fun playing exciting games and win real cash. We're looking for a creator who can effectively replicate a provided video in their unique style that showcases the enjoyment and potential cash winning possibilities while using the app."
d9fea169-9d0d-49cd-9af3-d64d47957e8a,Swish Live ,"Transform your sports broadcasting with Swish Live. Manage real-time scoreboards, stream on Facebook and boost sponsor visibility. Supports multiple sports with real-time commentary.","Swish Live is a unique app that lets you broadcast your sporting events like a TV professional, straight from your smartphone. Take charge of the real-time scoreboard, stream matches directly on Facebook and generate sponsor visibility. The app supports a variety of sports including football, volleyball, tennis, rugby, basketball and more. Furthermore, it comes with the ability to provide live commentary, enhancing the viewing experience for your fans."
b34e94e9-5d4d-4d4b-b245-d19f2d2139b5,The Oregon Trail: Boom Town,"Embark on a thrilling journey with The Oregon Trail: Boom Town! Build, grow, harvest, and transform a small village into a thriving town.",Please find brief here: https://app.milanote.com/1RXJwF1ewBu17A?p=HRkc8lhvCoE
b797312a-5fad-4443-9476-10c5dddc9ee8,Mob Control,"Mob Control is a thrilling mobile game where you create massive mobs by shooting through multiplier gates, unlocking powerful combinations of cannons, mobs, and champions, and leveling up your combo to rise at the top of the League.","Mob Control is a simple yet exciting arcade mobile game. Create massive mobs and lead them to victory! Aim and shoot onto multiplier gates to increase your crowd and capture all the bases! Unlock the best combo of cannons, mobs and champions to rise at the top of the Champions League. Deploy your Champions to break through the enemy mob and reach their base. Choose your favorite cannon and discover the evolution as you level it up.
When you apply, please briefly explain the hook you intend to use (see brief)."
"44a5334a-57e7-4efe-93d5-f3b7e834be5f",Yubo: Find Your Online Besties,"Showcase the fun of Yubo, and how you can have a trustful online friends. ","Reproduce this kind of video : https://www.tiktok.com/@faihypen/video/7315845814465727777?q=that%20one%20line%20friend&t=1725443067937
Any hook ""caption-beginning"" message have to contain ""Me & that one online friend""+ below example ..........  : "
"71f83cdc-a641-47f6-9dc3-4d770c665cc0",Swipewipe,Swipewipe is the app that will (finally) help you clean up your camera roll. And you’ll enjoy reminiscing while you do it.,"Welcome to **Swipewipe** — the app that'll (finally) help you clean up your camera roll.

We wanted a simple, fast, elegant solution that let us go month-by-month, work our way through all the photos, videos, screenshots, and everything else in our camera roll, and decide - one by one - what to keep and what to get rid of.

Swipe right to keep a photo, and left to delete it. If you make a mistake,  just tap the current photo to go back.

Our camera rolls shouldn't be such a mess. Scrolling back, you should be able to see the memories you've made without getting interrupted by blurry duplicates, irrelevant screenshots, and other clutter that keeps you from the good stuff."
"436ac4a3-1d4d-468b-ade9-631df28bdec8",Yubo ,"Yubo est une application qui permet de se faire des amis avec le même intérêt, autour de toi ou dans le monde entier. ","Yubo, ton application pour te connecter et rencontrer de nouvelles personnes à travers le monde. Swipe, chat, et stream avec des personnes autour de toi ou du monde entier. Amuse-toi avec la nouvelle fonctionnalité de Yubo : des appels vidéo 1 à 1 aléatoires pour rencontrer de nouvelles personnes."
"9a16b0e1-9077-41cd-b4a3-852a824a474b",WEBTOON,"Faites la promo de la série ""Love 4 a Walk"" sur l'application WEBTOON ! ","Faites la promotion de la série ""Love 4 a Walk"" sur l'application WEBTOON ! Créez le buzz autour de la série sur TikTok et suscitez la curiosité des utilisateurs."
"427f4ca2-6ce5-425d-a9ae-463bc87a9a65",Liligo,"L’objectif est d’accroître la notoriété en tant que comparateur de voyages, soulignant la simplicité et l'exhaustivité des offres & partenaires pour trouver les meilleures offres de voyage. ","Messages : 
Life Hack pour économiser : en une recherche on compare parmi des centaines de partenaires pour proposer le meilleur prix - mettre en avant l'idée que Liligo simplifie le processus de recherche de voyages et offre les meilleures options au meilleur prix. Explorer le monde sans se ruiner.

Life hack moyen de transport : en une recherche on compare et combine les prix des vols, trains, bus puis vous choisissez l’option la mieux adaptée à vos besoins. Il en va de même pour la recherche de locations de voiture. Mettre en évidence la simplicité de Liligo - au lieu d’avoir de multiples onglets ouverts, on compare tous les moyens de transport en une recherche
Appel à l'Action : Encourager à visiter le site et/ou télécharger l'application Liligo, disponible sur iOS et Android.
Simuler la création d'une “Alerte prix“ : Besoin de savoir quand réserver ? Activez l’alerte prix ! 🌍 Explorez plus pour moins cher avec Liligo !
Utiliser la fonction ""Explorer"" pour montrer la variété des options de voyage.

Exemples : https://library.tiktok.com/ads/detail/?ad_id=1780808687590434 // https://www.tiktok.com/@agatha.catchrain/video/7133594013705211141?is_from_webapp=1&web_id=7300870562347533857 "
"9b2b4182-3653-46d1-9b1b-b125b83b6446",Wizz,"Specific Australian campaign: targeting only users in Australia.
Join the global friendship campaign with Wizz! Meet new friends in a positive and safe community. Let's bring the world closer.","Campaign goal: 
Targeting only users in Australia, so feel free to add any cultural/geographic references to your videos.

Brief:
Wizz is a social networking app that brings the world closer to you. The goal of this campaign is to showcase Wizz as a platform where users can make new friends from all corners of the globe. The focus should be on creating genuine bonds in a safe and vibrant community. With millions of downloads already, the wizz is all about spreading positivity and bridging cultural gaps."
ac155ef6-3cd4-4816-b26e-cdf79403e8a0,PhotoRoom,"""PhotoRoom"" is a mobile photo editing app, designed to make your product images and marketing materials look professional and appealing.","Just a heads up: In this campaign, it is highly recommended to submit a creative brief in advance since only 6 creators will be chosen. Once you apply, you will receive an email inviting you to submit your brief.

""PhotoRoom"" is a mobile photo editing app, designed to make your product images and marketing materials look professional and appealing. It's aimed at creators, online sellers, and anyone wanting to make their photos look perfect. The app includes features for removing backgrounds, batch editing, precise cutouts, retouching, resizing, and smart templates. Also, it offers instant backgrounds using artificial intelligence, saving you time and effort. "
"53987e0c-f309-4d78-9085-6ce8c5283c51",Wemoms,"Discover Wemoms, your ultimate pregnancy companion! Track your baby's daily growth and visualize their development with our 3D baby tracker. Embrace the journey to parenthood with personalized insights and a seamless, user-friendly experience","Elevate your pregnancy experience with Wemoms, a comprehensive tool designed for expecting parents. Stay connected to your baby's growth on a daily basis as you follow their size evolution. Our cutting-edge 3D baby tracker offers a captivating visual representation, making the journey even more intimate. With Wemoms, you receive personalized insights, relevant information, and a user-friendly interface that ensures a seamless experience. Navigate each stage of pregnancy confidently, celebrating the daily milestones and creating lasting memories as you prepare for the arrival of your little one."
e11ce588-e7f3-4fb1-93d4-1909cfa5493c,Fruitz,"Join the trend and promote Fruitz, a unique, values-driven dating app with a fun twist. Help users discover their perfect match based on their personal dating preferences.","Fruitz App's campaign is all about promoting a unique dating experience that allows individuals to choose exactly what they want from their matches through a fun and innovative 'fruit' system. By highlighting positive core values such as honesty, freedom, humor, tolerance, and kindness, the goal is to showcase the app in a fresh and exciting way that appeals to a wide range of potential users."
a06d11d5-d581-4c7c-acb0-dae98d7413a2,Weasyo,"Join us in promoting Weasyo, empowering users to manage finances with ease.","Join us in launching Weasyo, a revolutionary financial management app. Weasyo goes beyond basic expense tracking to offer powerful insights and intuitive budget creation. Ideal for individuals or families, it visualizes your financial health comprehensively."
e24f9a23-9b05-4e49-965c-b91e1d558fa2,Tomplay sheet music,Tomplay est une application de partitions musicales innovante avec un large catalogue et des outils pour personnaliser votre expérience de jeu. Faites vivre votre pratique de la musique !,"Tomplay est une application formidable qui donne vie à la pratique de la musique. Elle offre une multitude de partitions classiques et modernes, toutes synchronisées avec la musique pour une expérience de jeu immersive. Les musiciens peuvent personnaliser leur expérience en choisissant leur propre tempo, en enregistrant leurs performances et en obtenant des commentaires instantanés. Que vous soyez amateur ou professionnel, Tomplay est là pour vous aider à perfectionner votre art."
bb51bc29-46fb-4230-bd81-335089d1960a,Poker Face,"The objective is to encourage users to download the game and then make a purchase. To do this, we'd like the acting approach to be really to attract the user to come and play with us.","The idea of the concepts would be to highlight that it is a poker game online with real people and with live camera. We can highlight the fact that we can meet people from around the world. It’s important to have an attiude that makes users want to come and play the game with you. If they download now, they'll also be offered several million chips to start playing.

The key point of the game is the Live camera: everyone sees everyone else, you can also talk and, above all, you can try to guess who's bluffing or not! 

You don't have to be a very good poker player to enjoy the game and have fun!

Things to avoid: not showing or mentioning poker gameplay errors
"
"117d1684-d5b1-4712-b221-199f947fd336",PNK,"With PNK, teenagers can discover new friends with shared interests in a safe and fun environment. Find your perfect friend match with ease!"," Whether a teenager is seeking a study companion, a gaming partner, or just someone to hang out with, PNK assists them in finding their perfect friend match in a youthful, safe, and entertaining atmosphere.
"
"90ad498b-962f-48e7-809a-94695b56d25d",Yubo: Make friends in your way,Yubo is a social platform aimed at helping users make new friends all around the world.,"Yubo is highlighting its socially responsible approach to networking, ensuring a safe and authentic space for users. With millions of users globally, Yubo helps people make genuine friends through chat and live conversations. In a world where social networking can often feel daunting, Yubo stands out as a beacon of authenticity and safety. We believe in being forever young, curious, and unapologetically ourselves. Yubo is more than just an app; it’s a community where you can express your true colors without being judged—no likes, no shares, no comparisons—and expand your mind through meaningful conversations with people from around the globe.
"
f5040ca9-5913-45a0-9f3d-5bd8eca60bb2,Reverse Coloring Book,"Unleash your creativity with Reverse Coloring Book App. It has colors, you draw the lines! Reverse Coloring App is a totally new idea in creativity and mindfulness: so simple, and so profoundly satisfying. ","With the Reverse Coloring Book app, we take you into a world where you dictate the strokes and the hues. What if we tell you that it's not about coloring within the lines anymore? With over 50 original watercolor illustrations left intentionally unfinished, this app sparks your creativity and sets it free. Dive into the world of art where you can trace, sketch, doodle, shade, or even dot your way to a masterpiece. Challenge the formal coloring rules, keep your tranquillity intact and make mindfulness meet imagination in a fusion that's seamless, fun, and creatively satisfying. Download and start creating!"
"067ac9c9-a9d6-452d-9782-47bfadf24384",Joko,"Dans cette campagne on commence par un hook de doute =>  C'est gratuit ? C'est pas gratuit, ok c'est gratuit.","Dans cette campagne on commence par un hook de doute =>  C'est gratuit ? C'est pas gratuit, ok c'est gratuit."
